{
  "schema_version": 1,
  "task_id": "WO-PAT-TRIAL-001",
  "revision": 2,
  "objective": "背景：本任务 revision 1 已于 2026-10-06 执行：执行器机制链真实走通（Worker 完成、三轮独立审查、零 GitHub 写副作用），但文档内容连续三轮 changes_required 且两轮返修预算耗尽而停止——即 r1 因内容审查未通过而停止，不是执行器故障或资源预算失败。本修订 r2 不改机制，只收窄并澄清文档要求。仅新增一个文件 docs/pat-delivery-runbook.md：用简体中文写给仓库使用者，开篇先按 docs/pat-setup.md 与 docs/adr/0007-fine-grained-pat-stage.md 对齐两个定义并在全文一致使用：可信 Python 控制程序＝在模型之外运行的固定 Python 编排/执行代码（agent-delivery CLI 及其直接子进程），Claude 模型 Worker＝由 Claude Code 以固定模型驱动、只接收工单与仓库工作树的子进程。文档只覆盖六个主题：(1) 预检与交付顺序——先安装来源核对，再 agent-delivery check-github-auth 只读预检（账号/仓库/PR/Actions 读取），预检通过后才由安装版 deliver 执行写操作链；(2) Plan 授权与 Delivery 审查的区别——Plan PR 是用户对固定任务的预先授权（独立审查确认工单无扩大范围、精确 head CI 通过后合并），Delivery PR 是 Worker 成果的质量门禁（独立 pass 绑定候选完整 head、唯一 validate 成功、match-head-commit 合并），Worker 不批准自己的工单；(3) PAT 不交给模型 Worker——令牌只存在于可信 Python 控制程序边界内，Claude 模型 Worker 与独立审查不获得令牌值；(4) local_ready、merged、deployed 的区别——本地结构化完成≠Delivery PR 已合入 main≠已部署验证，本阶段不存在 deployed，不得混称；(5) 精确 SHA 与 CI 门禁——审查与合并绑定完整 40 位 head，CI 只认 .github/workflows/ci.yml 的 pull_request 运行、精确 head SHA、固定 attempt 全部任务成功且唯一 validate 成功，空检查列表不是成功；(6) 失败停止与人工处理——PAT 缺失、权限不足、账号错配、CI 失败或缺失、远端结果不明时停止并给出最小人工配置步骤，不回退日常 gh 登录、classic PAT 或匿名身份，不盲目重放写操作。文中链接已有 PAT 说明（docs/pat-setup.md），不复制凭据。不要求也不得展开：凭据环境变量及其传递细节、Git 凭据传输内部机制、resume 的详细保证。操作要求与已验证能力分开写：流程应如何执行写成操作要求，证据文件记录的实测结果写成已验证能力，不把规范要求表述为已实测通过。",
  "out_of_scope": [
    "不修改任何 Python 源码、测试、CI、打包或 .agents/ 下任何文件",
    "不修改既有文档（README、docs/ 全部现有文件）",
    "不执行真实 agent-run、审查 CLI 或任何 GitHub 写操作",
    "不描述未在所附证据中体现的命令、参数或行为",
    "不写入任何令牌值、令牌摘要或本机私有路径",
    "不介绍凭据环境变量或 Git 凭据传输的内部机制，不给出 resume 的详细保证，不把规范要求表述为实测结果"
  ],
  "acceptance_criteria": [
    "仓库中存在且仅存在一个新文件 docs/pat-delivery-runbook.md，为简体中文",
    "开篇对齐并使用两个定义：可信 Python 控制程序（模型之外的固定 Python 编排/执行代码）与 Claude 模型 Worker（由 Claude Code 固定模型驱动、只接收工单与仓库工作树的子进程），与 docs/pat-setup.md 和 docs/adr/0007-fine-grained-pat-stage.md 的表述一致",
    "包含且仅包含六个主题小节：预检与交付顺序、Plan 授权与 Delivery 审查的区别、PAT 不交给模型 Worker、local_ready/merged/deployed 的区别、精确 SHA 与 CI 门禁、失败停止与人工处理",
    "写明：预检只读成功不能证明写权限；write_permissions_verified/protection_verified/delivery_verified 在预检中为假",
    "写明：Plan 合并是预授权例外且不构成对后续任务的自动批准；Delivery 合并需独立 pass、唯一 validate 成功、match-head-commit 且远端 head 未漂移",
    "写明：本阶段无 deployed 状态，不得把 local_ready 或 merged 称为部署完成",
    "写明：CI 契约为精确 head 的 ci.yml pull_request 运行、固定 attempt 任务全部成功且唯一 validate，空列表不通过",
    "写明：失败时停止并给出最小人工步骤，不换身份、不重放写操作",
    "操作要求与已验证能力分开表述：规范/操作要求不得写成已实测通过，已验证能力仅限证据文件记录的内容",
    "不包含凭据环境变量、Git 凭据传输内部机制或 resume 详细保证的描述",
    "链接已有 PAT 说明（docs/pat-setup.md），不含任何认证值或本机私有路径"
  ],
  "allowed_paths": [
    "docs/pat-delivery-runbook.md"
  ],
  "worker_profile": "claude-code-v1",
  "skill_ref": ".agents/policies/delivery-skill/SKILL.md",
  "stop_conditions": [
    "验收所需信息在可读取的仓库文件或资料包证据中不存在时停止并报告 blocked，不得编造行为细节",
    "需要修改 allowed_paths 之外任何文件时停止",
    "对证据内容与要写内容的一致性不确定时停止，不猜测"
  ],
  "limits": {
    "max_turns": 24,
    "timeout_seconds": 900,
    "max_budget_usd": 5
  },
  "review_evidence": [
    {
      "path": "docs/pat-setup.md",
      "ref": "1206204b4248a0d32aa16574fee7b0270a9d9dac",
      "purpose": "可信 Python 控制程序与 Claude 模型 Worker 的定义、PAT 接入与推荐权限、check-github-auth 预检语义与失败停止边界"
    },
    {
      "path": "docs/adr/0007-fine-grained-pat-stage.md",
      "ref": "1206204b4248a0d32aa16574fee7b0270a9d9dac",
      "purpose": "当前阶段 PAT 身份决策与边界澄清（可信 Python 可用 PAT、模型不可）、备选保留与未验证项"
    },
    {
      "path": "docs/goal-pat-trial.md",
      "ref": "1206204b4248a0d32aa16574fee7b0270a9d9dac",
      "purpose": "六主题固定任务规格原文：预检与交付顺序、Plan/Delivery 区别、local_ready/merged/deployed、精确 SHA 与 ci.yml/validate 门禁、失败停止与人工配置边界的措辞出处"
    }
  ]
}
