{
  "schema_version": 1,
  "task_id": "WO-B2-REPORT-001",
  "revision": 2,
  "objective": "背景：revision 1 的正式交付在 Worker 阶段以 incomplete 停止（无候选、无副作用，记录保留）；本 r2 只调整输入明确化与验证分工，不宣称根因已修复，不改调度/完成判定/Skill/schema/权限/预算。任务：实现 agent-delivery report --orchestration-id <UUID>，默认输出一个简短 JSON 摘要，不增加其他格式或报表选项。记录字段以内联映射为准，不要求通读编排源码；若映射与实际记录结构不符，停止并报告，不猜测。内联白名单映射（输出名 ← 记录字段路径；类型；缺失处理）：orchestration_id ← 顶层 orchestration_id（UUID）；task ← authorization.task_id（字符串；缺失 null）；revision ← 记录无独立字段，固定输出 null（不解析文件名推测）；stage ← 顶层 stage（已知枚举，如 completed/review_blocked/evidence_ready）；run_id ← worker.run_id（UUID 或 null）；session_id ← worker.session_id（UUID 或 null）；delivery_commit ← delivery_pr.head（完整 40 位 SHA 或 null）；delivery_pr ← delivery_pr.number（整数或 null）。脱敏样例（真实白名单值）：R10 型 → {\"orchestration_id\":\"2eb4742a-448e-41ae-a342-f9473c7516ad\",\"task\":\"WO-PAT-TRIAL-001\",\"revision\":null,\"stage\":\"review_blocked\",\"run_id\":\"1c8ec4c0-d573-40e8-b6a9-a7e3e85c8e28\",\"session_id\":\"80932a39-9c42-4f46-9025-1a3389da0fa3\",\"delivery_commit\":null,\"delivery_pr\":null}；B1 型 → {\"orchestration_id\":\"46d814b8-b778-41dd-8477-b412b7ed2387\",\"task\":\"WO-B1-DOCS-001\",\"revision\":null,\"stage\":\"completed\",\"run_id\":\"c3b99d61-2b36-44e5-8eab-b893ca31cb7e\",\"session_id\":\"f836c5d6-a26c-4a26-b036-145255bfe946\",\"delivery_commit\":\"4f39ce086878fb7897d938ea8de31f131f9e518c\",\"delivery_pr\":33}。MVP 契约：(1) 沿用现有状态目录定位规则（与 store.py 一致），UUID 严格校验，仅读指定编排 JSON，不遍历历史、不追踪任意路径；(2) 仅输出上述内联白名单；校验类型/格式；阻塞原因仅用 stage 表达，不推断自由文本；(3) 不联网、不启动模型、不读凭据、不修改记录及权限，不走会 mkdir/chmod/写状态或要求认证的初始化路径；(4) 基本检查：UUID、普通文件（拒绝符号链接）、合理大小上限、JSON 可解析、记录 ID 与请求一致；非法/缺失/损坏输入非零退出，错误为固定脱敏分类，不建设恶意并发防御库；(5) 成功读取失败/受阻任务也退出 0（表示报告读取成功，非任务成功）；(6) 不输出完整 JSON、原始错误、命令、认证源、个人路径或 Session 内容；缺少 PR 字段不代表远端无 PR，local_ready 不代表合并或部署；(7) 不改原记录或 schema，不把 R10 的后续人工接纳改写为原执行成功。仅用标准库与简单函数，不加依赖/缓存/监控/数据库/新状态机制。验证分工（重要）：你的责任仅为实现——代码、tests/test_report.py 与 README 用法已编写且范围正确即为完成；编译、实际运行测试、--help 与双 ID 验收属外层发布/安装门禁，你的环境可能无 shell 工具，不要求现场执行，也不得虚报已运行；未运行的外层检查不算你的未完成事项；真实代码未完成仍必须如实报告 incomplete。README 仅新增一小节用法：占位符示例、离线性说明与退出码含义。若接线确需修改 allowed_paths 之外文件，停止说明，不越界。",
  "out_of_scope": [
    "不修改 allowed_paths 之外任何文件；接线需要越界时停止说明",
    "不新增依赖或非标准库模块；不加缓存/监控/数据库/新状态机制/其他输出格式",
    "不改既有调度、完成判定、Skill、工单 schema、权限或预算",
    "不执行任何 GitHub 写操作",
    "不在输出或 README 暴露真实个人路径、凭据位置、完整记录内容或会话",
    "不虚报已运行未运行的检查；不把外层门禁当成 Worker 现场职责",
    "不声称任何远端当前状态（命令纯离线）"
  ],
  "acceptance_criteria": [
    "仅 src/agent_delivery_loop/cli.py、src/agent_delivery_loop/report.py（新建）、tests/test_report.py、README.md 四路径被修改",
    "agent-delivery report --orchestration-id <UUID> 子命令注册，默认输出单个简短 JSON 摘要，无其他格式或报表选项",
    "输出恰为内联白名单字段，映射与两个脱敏样例一致；revision 固定 null（除非记录出现独立 revision 字段则如实输出）",
    "UUID 校验、仅普通文件、拒绝符号链接、大小上限、JSON 解析、记录 ID 一致性检查齐备；非法/缺失/损坏输入非零退出且错误为固定脱敏分类",
    "沿用 store.py 状态目录定位；不实例化副作用初始化路径；不联网、不读凭据、不修改记录及权限",
    "成功读取 completed 与 blocked 两类记录均退出 0（退出码表示报告读取成功与否）",
    "输出不含完整 JSON、原始错误、命令、认证源、绝对路径或 Session 内容；PR 缺失为 null 不断言远端无 PR",
    "tests/test_report.py 已编写少量高价值聚焦用例：合成 completed/blocked 记录读取、无状态写入、非法/缺失/损坏输入、敏感字段不输出",
    "README 新增简短用法小节：占位符示例、离线性说明、退出码含义；无真实路径或凭据",
    "实现仅用标准库简单函数；完成状态如实申报：实现责任完成即完成，外层编译/测试/--help/双 ID 验收不虚报、不列为 Worker 未完成事项"
  ],
  "allowed_paths": [
    "src/agent_delivery_loop/cli.py",
    "src/agent_delivery_loop/report.py",
    "tests/test_report.py",
    "README.md"
  ],
  "worker_profile": "claude-code-v1",
  "skill_ref": ".agents/policies/delivery-skill/SKILL.md",
  "stop_conditions": [
    "内联映射与实际记录结构不符时停止并报告，不猜测",
    "需要修改 allowed_paths 之外任何文件才能接线时停止说明",
    "信息不足或语义不确定时停止，不编造"
  ],
  "limits": {
    "max_turns": 24,
    "timeout_seconds": 900,
    "max_budget_usd": 5
  },
  "review_evidence": [
    {
      "path": "src/agent_delivery_loop/cli.py",
      "ref": "64637592658074876ad784c964402fc961c1f295",
      "purpose": "子命令注册与参数接线现状（argparse 结构）"
    },
    {
      "path": "src/agent_delivery_loop/store.py",
      "ref": "64637592658074876ad784c964402fc961c1f295",
      "purpose": "状态目录定位规则与副作用边界"
    },
    {
      "path": "src/agent_delivery_loop/review_cli.py",
      "ref": "64637592658074876ad784c964402fc961c1f295",
      "purpose": "只读子命令、脱敏输出与固定错误分类风格参照"
    }
  ]
}
